MCQ,Choices,Correct
What term was coined in 1959 by Arthur Samuel to describe the field of computer gaming and artificial intelligence?,a: Machine thinking | b: Computer logic | c: Machine learning | d: Artificial intelligence,c
"Who published the book 'The Organization of Behavior' in 1949, introducing a theoretical neural structure?",a: Arthur Samuel | b: Donald Hebb | c: Walter Pitts | d: Warren McCulloch,b
What was the name of the experimental 'learning machine' developed by Raytheon Company in the early 1960s?,a: Cybernetics | b: Cyberspace | c: Cybertron | d: Cyberlink,c
"According to Tom M. Mitchell, what is the definition of a computer program learning from experience?",a: Improving performance without experience | b: Improving performance with respect to tasks | c: Not learning from experience | d: Learning from theoretical knowledge,b
What are the two objectives of modern-day machine learning?,a: To predict future outcomes and classify data | b: To analyze historical data and make decisions | c: To create new algorithms and test them | d: To study human cognitive processes,a
